{
  "FormData": {
    "id": 9001,
    "name": "HVAC Service - Cooling Inspection",
    "active": true,
    "locked": false,
    "hide": false,
    "ownerTypes": [
      "Job"
    ],
    "applyTagsTargets": [],
    "showOnMobile": true,
    "allowEmptyToPresent": false,
    "canDelete": false,
    "sendOnEvents": [
      "JobCompletion"
    ],
    "dwyerBigBoardReport": false,
    "createdOn": "2026-01-01T00:00:00.000Z",
    "modifiedOn": "2026-01-01T00:00:00.000Z",
    "definition": {
      "id": 9002,
      "version": 1,
      "published": true,
      "definition": {
        "rootSection": {
          "unitType": "Section",
          "canBeDuplicated": false,
          "units": [
            {
              "unitType": "Section",
              "canBeDuplicated": true,
              "units": [
                {
                  "unitType": "StaticElement",
                  "htmlContent": "<h3>Job Information</h3>",
                  "header": false,
                  "isPrintViewOnly": false,
                  "id": "4067c358-4ee2-47f8-9a94-e3e8ab73738f"
                },
                {
                  "fieldType": "Text",
                  "unitType": "Field",
                  "isRequired": false,
                  "name": "CUSTOMER NAME",
                  "description": "",
                  "id": "0925e474-9b57-4bd1-b653-f8dd9b1f282e",
                  "smartFieldTag": "CustomerName"
                },
                {
                  "fieldType": "Text",
                  "unitType": "Field",
                  "isRequired": false,
                  "name": "LOCATION",
                  "description": "",
                  "id": "ffed9235-288b-4781-ae66-267594c9c950",
                  "smartFieldTag": "LocationAddress"
                },
                {
                  "fieldType": "Text",
                  "unitType": "Field",
                  "isRequired": false,
                  "name": "TECHNICIAN",
                  "description": "",
                  "id": "cdbd47d3-64be-4049-a372-db8f6e405d93",
                  "smartFieldTag": "TechnicianName"
                },
                {
                  "fieldType": "Date",
                  "unitType": "Field",
                  "isRequired": false,
                  "name": "DATE",
                  "description": "",
                  "id": "82523e86-feac-4eb7-9c38-f519b91751da",
                  "smartFieldTag": "TodayDate"
                },
                {
                  "fieldType": "Dropdown",
                  "unitType": "Field",
                  "isRequired": true,
                  "name": "SYSTEM TYPE",
                  "description": "",
                  "id": "d95bafc8-f2a4-427b-9cf4-bb99f4bea973",
                  "values": [
                    "Split AC",
                    "Heat Pump",
                    "Packaged Unit",
                    "Mini Split"
                  ]
                },
                {
                  "fieldType": "Text",
                  "unitType": "Field",
                  "isRequired": true,
                  "name": "MODEL / SERIAL #",
                  "description": "Model and serial for each unit, or attach a photo.",
                  "id": "5c6e4337-15ba-4bdd-9772-19d30e7a269f"
                },
                {
                  "fieldType": "Text",
                  "unitType": "Field",
                  "isRequired": true,
                  "name": "OUTSIDE TEMPERATURE",
                  "description": "",
                  "id": "cf1822ff-bc68-4778-ab49-1044d5e34124"
                }
              ],
              "name": "Job Information",
              "id": "ef8acd12-8b4f-4fc1-9f3f-57ebf30b94fa"
            },
            {
              "unitType": "Section",
              "canBeDuplicated": true,
              "units": [
                {
                  "unitType": "StaticElement",
                  "htmlContent": "<h3>Electrical</h3>",
                  "header": false,
                  "isPrintViewOnly": false,
                  "id": "e6b58de7-44ab-4cce-8087-7b6f71e1f6d2"
                },
                {
                  "unitType": "StaticElement",
                  "htmlContent": "<p>Mark each task PASS or FAIL. For a FAIL, note what failed and what action is required. Record readings where asked.</p>",
                  "header": false,
                  "isPrintViewOnly": false,
                  "id": "5d300cb9-0706-4045-9efc-044a09325626"
                },
                {
                  "fieldType": "Checkbox",
                  "unitType": "Field",
                  "isRequired": true,
                  "name": "INSPECT ELECTRICAL DISCONNECT",
                  "description": "",
                  "id": "e8624fab-5186-4e32-ae8d-7ee9770348a0",
                  "values": [
                    "Passed Inspection",
                    "Failed Inspection - Attention Required",
                    "N/A"
                  ],
                  "horizontalLayout": false
                },
                {
                  "fieldType": "Checkbox",
                  "unitType": "Field",
                  "isRequired": true,
                  "name": "CHECK EQUIPMENT GROUNDING",
                  "description": "",
                  "id": "e2520e33-e44c-4055-ac71-c4a66148a86f",
                  "values": [
                    "Passed Inspection",
                    "Failed Inspection - Attention Required",
                    "N/A"
                  ],
                  "horizontalLayout": false
                },
                {
                  "fieldType": "Text",
                  "unitType": "Field",
                  "isRequired": true,
                  "name": "MEASURE & RECORD LINE VOLTAGE",
                  "description": "",
                  "id": "2d6c797f-8f7d-4b78-aa1b-e9cd8697bbd0"
                },
                {
                  "fieldType": "Checkbox",
                  "unitType": "Field",
                  "isRequired": true,
                  "name": "INSPECT & TEST CONTACTORS & RELAYS",
                  "description": "",
                  "id": "2d3d854e-061b-4030-bb08-c6e33c729578",
                  "values": [
                    "Passed Inspection",
                    "Failed Inspection - Attention Required",
                    "N/A"
                  ],
                  "horizontalLayout": false
                },
                {
                  "fieldType": "Checkbox",
                  "unitType": "Field",
                  "isRequired": true,
                  "name": "INSPECT & TEST CAPACITORS",
                  "description": "",
                  "id": "829a48d4-22fe-49a2-ac70-501e533c9135",
                  "values": [
                    "Passed Inspection",
                    "Failed Inspection - Attention Required",
                    "N/A"
                  ],
                  "horizontalLayout": false
                },
                {
                  "fieldType": "Checkbox",
                  "unitType": "Field",
                  "isRequired": true,
                  "name": "CLEAN & TIGHTEN ELECTRICAL CONNECTIONS",
                  "description": "",
                  "id": "83844b40-ffa9-49f1-9c14-bc4a829e07b0",
                  "values": [
                    "No Adjustment Needed",
                    "Cleaned and Tightened",
                    "N/A"
                  ],
                  "horizontalLayout": false
                }
              ],
              "name": "Electrical",
              "id": "fec3f6b3-2e8d-4b8a-8f54-f8ceacaab39e"
            },
            {
              "unitType": "Section",
              "canBeDuplicated": true,
              "units": [
                {
                  "unitType": "StaticElement",
                  "htmlContent": "<h3>Condensate</h3>",
                  "header": false,
                  "isPrintViewOnly": false,
                  "id": "6a27e0df-cbf8-4544-b215-4e76e4c11ab2"
                },
                {
                  "fieldType": "Checkbox",
                  "unitType": "Field",
                  "isRequired": true,
                  "name": "INSPECT & CLEAN CONDENSATE DRAIN",
                  "description": "",
                  "id": "e89204e2-e816-4561-867e-5e15bc01bfce",
                  "values": [
                    "Clear - No Action Needed",
                    "Cleaned",
                    "N/A"
                  ],
                  "horizontalLayout": false
                },
                {
                  "fieldType": "Checkbox",
                  "unitType": "Field",
                  "isRequired": true,
                  "name": "TEST DRAIN PAN SAFETY SWITCH",
                  "description": "",
                  "id": "97eeab64-ca2c-46bc-9d3f-d983c34c769f",
                  "values": [
                    "Passed Inspection",
                    "Failed Inspection - Attention Required",
                    "N/A"
                  ],
                  "horizontalLayout": false
                },
                {
                  "fieldType": "Checkbox",
                  "unitType": "Field",
                  "isRequired": true,
                  "name": "TEST CONDENSATE PUMP",
                  "description": "",
                  "id": "dbe53fca-fb21-47df-9ca4-95fa5a91c89b",
                  "values": [
                    "Passed Inspection",
                    "Failed Inspection - Attention Required",
                    "No Condensate Pump"
                  ],
                  "horizontalLayout": false
                }
              ],
              "name": "Condensate",
              "id": "f4767f26-2943-45b2-b21d-ea3bf63f23d0"
            },
            {
              "unitType": "Section",
              "canBeDuplicated": true,
              "units": [
                {
                  "unitType": "StaticElement",